{
  "$schema": "http://json-schema.org/draft-07/schema#",
  "title": "Simulator Schema",
  "type": "object",
  "properties": {
    "simulator_id": {
      "type": "string",
      "description": "Unique identifier for the simulator"
    },
    "name": {
      "type": "string",
      "description": "Name of the simulator"
    },
    "version": {
      "type": "string",
      "description": "Version of the simulator"
    },
    "category": {
      "type": "string",
      "description": "Category of the simulator"
    },
    "sub_category": {
      "type": "string",
      "description": "Sub-category of the simulator"
    },
    "description": {
      "type": "string",
      "description": "Detailed description of the simulator"
    },
    "platform": {
      "type": "string",
      "description": "Platform or environment where the simulator runs"
    },
    "input_formats": {
      "type": "array",
      "description": "List of supported input formats",
      "items": {
        "type": "string"
      }
    },
    "output_formats": {
      "type": "array",
      "description": "List of supported output formats",
      "items": {
        "type": "string"
      }
    },
    "developer": {
      "type": "string",
      "description": "Name of the developer or organization"
    },
    "license": {
      "type": "string",
      "description": "License type"
    },
    "website": {
      "type": "string",
      "description": "Official website or repository URL"
    },
    "documentation": {
      "type": "string",
      "description": "URL to the documentation"
    },
    "last_updated": {
      "type": "string",
      "format": "date",
      "description": "Date when the simulator was last updated"
    },
    "objects": {
      "type": "array",
      "description": "Objects used in the simulator",
      "items": {
        "type": "object",
        "properties": {
          "object_id": {
            "type": "string",
            "description": "Unique identifier for the object"
          },
          "name": {
            "type": "string",
            "description": "Name of the object"
          },
          "attributes": {
            "type": "array",
            "description": "List of attributes of the object",
            "items": {
              "type": "string"
            }
          },
          "processes": {
            "type": "array",
            "description": "List of processes the object can use",
            "items": {
              "type": "string"
            }
          },
          "boundary_conditions": {
            "type": "array",
            "description": "List of boundary conditions the object adheres to",
            "items": {
              "type": "string"
            }
          }
        },
        "required": ["object_id", "name", "attributes"]
      }
    },
    "processes": {
      "type": "array",
      "description": "Processes used in the simulator",
      "items": {
        "type": "object",
        "properties": {
          "process_id": {
            "type": "string",
            "description": "Unique identifier for the process"
          },
          "name": {
            "type": "string",
            "description": "Name of the process"
          },
          "description": {
            "type": "string",
            "description": "Detailed description of the process"
          }
        },
        "required": ["process_id", "name"]
      }
    },
    "boundaries": {
      "type": "object",
      "description": "Boundary conditions for the simulator",
      "properties": {
        "spatial": {
          "type": "string",
          "description": "Spatial boundary conditions"
        },
        "temporal": {
          "type": "string",
          "description": "Temporal boundary conditions"
        }
      }
    },
    "containment": {
      "type": "array",
      "description": "Containment relationships within the simulator",
      "items": {
        "type": "object",
        "properties": {
          "outer_object_id": {
            "type": "string",
            "description": "ID of the outer containing object"
          },
          "inner_object_id": {
            "type": "string",
            "description": "ID of the inner contained object"
          }
        },
        "required": ["outer_object_id", "inner_object_id"]
      }
    }
  },
  "required": ["name", "category", "description"]
}
