{
  "simulator_id": "sim_005",
  "name": "Tissue Forge",
  "version": "",
  "category": "Virtual Tissue",
  "description": "Tissue Forge is an interactive, particle-based physics, chemistry and biology modeling and simulation environment.",
  "platform": "Cross-platform",
  "input_formats": [],
  "output_formats": [],
  "developer": "T.J. Sego",
  "license": "Open-source",
  "website": "https://tissue-forge-documentation.readthedocs.io/en/latest/index.html#",
  "documentation": "https://tissue-forge-documentation.readthedocs.io/en/latest/index.html#",
  "last_updated": "2024-06-01"
}
