{
  "simulator_id": "sim_006",
  "name": "BioDynaMo",
  "version": "1.0.4",
  "category": "Virtual Tissue",
  "description": "Software platform to easily create, run, and visualise 3D agent-based simulations",
  "platform": "Cross-platform",
  "input_formats": [],
  "output_formats": [],
  "developer": "BioDynaMo Development Team",
  "license": "Open-source",
  "website": "https://biodynamo.org",
  "documentation": "http://physicell.mathcancer.org/documentation",
  "last_updated": "2022-10-05"
}
