{
  "simulator_id": "sim_007",
  "name": "SimuCell3D",
  "version": "",
  "category": "Virtual Tissue",
  "description": "A C++ cell-based simulation framework designed to simulate tissues in 3 dimensions with high geometrical resolution.",
  "platform": "Cross-platform",
  "input_formats": [],
  "output_formats": [],
  "developer": "SimuCell3D Development Team",
  "license": "Open-source",
  "website": "https://git.bsse.ethz.ch/iber/Publications/2024_runser_simucell3d",
  "documentation": "",
  "last_updated": "2024-06-01"
}
