{
  "simulator_id": "sim_001",
  "name": "CompuCell3D",
  "version": "4.5.0",
  "category": "Virtual Tissue",
  "description": "A flexible and extensible simulation environment for multi-cellular systems biology, including the use of cellular Potts models.",
  "platform": "Cross-platform",
  "input_formats": ["XML", "SBML", "Python"],
  "output_formats": ["VTK", "CSV", "HDF5"],
  "developer": "CompuCell3D Development Team",
  "license": "Open-source",
  "website": "http://www.compucell3d.org",
  "documentation": "http://www.compucell3d.org/Documentation",
  "last_updated": "2024-06-01",
  "objects": [
    {
      "object_id": "obj_001",
      "name": "Cell",
      "attributes": ["type", "volume", "surface_area"],
      "processes": ["proc_001", "proc_002"],
      "boundary_conditions": ["bc_001", "bc_002"]
    },
    {
      "object_id": "obj_002",
      "name": "ChemicalField",
      "attributes": ["name", "concentration", "diffusion_coefficient"],
      "processes": ["proc_003"],
      "boundary_conditions": ["bc_001"]
    }
  ],
  "processes": [
    {
      "process_id": "proc_001",
      "name": "CellGrowth",
      "description": "Process describing the growth of cells over time."
    },
    {
      "process_id": "proc_002",
      "name": "CellDivision",
      "description": "Process describing the division of cells."
    },
    {
      "process_id": "proc_003",
      "name": "ChemicalDiffusion",
      "description": "Process describing the diffusion of chemicals within the tissue."
    }
  ],
  "boundaries": {
    "pde_boundary_conditions": [
      {
        "bc_id": "bc_001",
        "description": "Dirichlet boundary condition for chemical concentration",
        "type": "Dirichlet",
        "value": 1.0
      },
      {
        "bc_id": "bc_002",
        "description": "Neumann boundary condition for chemical flux",
        "type": "Neumann",
        "value": 0.0
      }
    ],
    "geometric_constraints": [
      {
        "gc_id": "gc_001",
        "description": "Periodic boundary condition for cell movement",
        "type": "Periodic",
        "dimensions": ["x", "y"]
      }
    ]
  },
  "containment": [
    {
      "outer_object_id": "obj_002",
      "inner_object_id": "obj_001"
    }
  ]
}
