{
  "simulator_id": "sim_008",
  "name": "Artistoo",
  "version": "",
  "category": "Virtual Tissue",
  "description": "A framework for Cellular Potts Models that lets you build interactive, explorable simulation models of cells and tissues in the web browser using Javascript.",
  "platform": "Web browser",
  "input_formats": [],
  "output_formats": [],
  "developer": "Artistoo Development Team",
  "license": "Open-source",
  "website": "https://artistoo.net",
  "documentation": "",
  "last_updated": "2024-06-01"
}
