{
  "simulator_id": "sim_010",
  "name": "PolyHoop",
  "version": "",
  "category": "Virtual Tissue",
  "description": "A lightweight standalone C++ implementation of a mechanical model to simulate the dynamics of soft particles and cellular tissues in two dimensions.",
  "platform": "Cross-platform",
  "input_formats": [],
  "output_formats": [],
  "developer": "PolyHoop Development Team",
  "license": "Open-source",
  "website": "https://doi.org/10.17632/4jscxhkd2s.1",
  "documentation": "",
  "last_updated": "2024-06-01"
}
