{
  "simulator_id": "sim_004",
  "name": "Morpheus",
  "version": "",
  "category": "Virtual Tissue",
  "description": "A modeling and simulation environment for the study of multi-scale and multicellular systems, able to couple ODEs, PDEs and cellular Potts models.",
  "platform": "Cross-platform",
  "input_formats": [],
  "output_formats": [],
  "developer": "Morpheus Development Team",
  "license": "Open-source",
  "website": "https://morpheus.gitlab.io/",
  "documentation": "",
  "last_updated": "2024-06-01"
}
