{
  "simulator_id": "sim_002",
  "name": "PhysiCell",
  "version": "1.13.1",
  "category": "Virtual Tissue",
  "description": "A physics-based cell simulator that models 3D multicellular systems, focusing on the interactions of (off-lattice) cells with their microenvironment.",
  "platform": "Cross-platform",
  "input_formats": ["XML", "CSV", "MATLAB", "SBML"],
  "output_formats": ["SVG", "MAT", "CSV", "VTK"],
  "developer": "PhysiCell Development Team",
  "license": "Open-source",
  "website": "http://physicell.org",
  "documentation": "http://physicell.mathcancer.org/documentation",
  "last_updated": "2024-06-01"
}
