{
  "simulator_id": "sim_006",
  "name": "Biocellion",
  "version": "",
  "category": "Virtual Tissue",
  "description": "",
  "platform": "Cross-platform",
  "input_formats": [],
  "output_formats": [],
  "developer": "CompuCell3D Development Team",
  "license": "Open-source",
  "website": "https://www.biocellion.com/home",
  "documentation": "",
  "last_updated": "2024-06-01"
}
