{
  "simulator_id": "sim_011",
  "name": "Hybrid Automata Library (HAL)",
  "version": "",
  "category": "Virtual Tissue",
  "description": "A Java library that facilitates hybrid modeling: spatial models with interacting agent-based and PDE components, commonly used for oncology modeling.",
  "platform": "Cross-platform",
  "input_formats": [],
  "output_formats": [],
  "developer": "HAL Development Team",
  "license": "Open-source",
  "website": "https://halloworld.org/",
  "documentation": "",
  "last_updated": "2024-06-01"
}
