{
  "simulator_id": "sim_009",
  "name": "NetLogo",
  "version": "",
  "category": "Virtual Tissue",
  "description": "A multi-agent programmable modeling environment.",
  "platform": "Cross-platform",
  "input_formats": [],
  "output_formats": [],
  "developer": "NetLogo Development Team",
  "license": "Open-source",
  "website": "https://ccl.northwestern.edu/netlogo/",
  "documentation": "",
  "last_updated": "2024-06-01"
}
